{
 "schema_version": 1,
 "facts": [
  {
   "id": "FACT-001",
   "source_id": "repo-1",
   "location": "cmd/shogun/stats.go:39-44",
   "quote": "fs := a.newFlagSet(\"stats\")\n\tdir := fs.String(\"dir\", \"\", ...)\n\tif err := fs.Parse(args); err != nil {",
   "kind": "observation",
   "text": "cmdStats defines its flags on a FlagSet from a.newFlagSet and parses with fs.Parse; only --dir exists today."
  },
  {
   "id": "FACT-002",
   "source_id": "repo-1",
   "location": "cmd/shogun/stats.go:60-63",
   "quote": "if len(runs) == 0 {\n\t\tfmt.Fprintf(a.stderr, \"no runs in %s\\n\", root)\n\t\treturn ExitOK",
   "kind": "observation",
   "text": "With no runs, stats prints a message to stderr, nothing to stdout, exit 0."
  },
  {
   "id": "FACT-003",
   "source_id": "repo-1",
   "location": "cmd/shogun/stats.go:65-92",
   "quote": "fmt.Fprintf(tw, \"%s\\tdamaged\\t-\\t-...\\t%s\\n\", r.id, r.damaged)",
   "kind": "observation",
   "text": "The table loop both prints rows and accumulates totals (tot, byStatus, damaged, partial); a damaged run shows status 'damaged', dashes and the damage reason in the USAGE column; valid runs show attempts, ActiveSeconds/60 as minutes, five token counters, CostUSD and usage()."
  },
  {
   "id": "FACT-004",
   "source_id": "repo-1",
   "location": "cmd/shogun/stats.go:94-116",
   "quote": "spendAtLeast := \"\" // a damaged run's attempts and time are missing from the totals too ... if len(partial) > 0 || damaged > 0 { atLeast = \"at least \"",
   "kind": "observation",
   "text": "Totals have two lower-bound conditions: attempts/active time are 'at least' when any run is damaged; tokens/cost are 'at least' when any run is damaged or has usage incomplete/unknown. A 'not counted' line reports incomplete, unknown and damaged run counts."
  },
  {
   "id": "FACT-005",
   "source_id": "repo-1",
   "location": "cmd/shogun/stats.go:26-35",
   "quote": "func (r runStats) usage() string {",
   "kind": "observation",
   "text": "Usage state per run is one of ok / incomplete / unknown."
  },
  {
   "id": "FACT-006",
   "source_id": "repo-1",
   "location": "cmd/shogun/other.go:134,154-157",
   "quote": "asJSON := fs.Bool(\"json\", false, \"print state.json\") ... data, _ := json.MarshalIndent(st, \"\", \" \")\n\t\tfmt.Fprintln(a.stdout, string(data))",
   "kind": "observation",
   "text": "Existing --json idiom: a bool flag named asJSON, json.MarshalIndent with one-space indent, printed with Fprintln to a.stdout."
  },
  {
   "id": "FACT-007",
   "source_id": "repo-1",
   "location": "internal/run/run.go:43-58",
   "quote": "InputTokens      int64   `json:\"input_tokens,omitempty\"` ... CostUSD          float64 `json:\"cost_usd,omitempty\"`",
   "kind": "observation",
   "text": "state.json uses snake_case names: attempts, active_seconds, input_tokens, cache_read_tokens, cache_write_tokens, output_tokens, reasoning_tokens, cost_usd; tokens are int64, seconds and cost float64."
  },
  {
   "id": "FACT-008",
   "source_id": "repo-1",
   "location": "cmd/shogun/stats_test.go:52-77",
   "quote": "code, out, errs := runCLI(t, ws, \"stats\") ... t.Fatal(\"stats changed a run\")",
   "kind": "observation",
   "text": "The existing test builds five runs (approved, paused without usage, needs_input, failed, one damaged), checks table/total substrings and that state.json is not changed."
  },
  {
   "id": "FACT-009",
   "source_id": "repo-1",
   "location": "cmd/shogun/main.go:87; README.md:237",
   "quote": "shogun stats [--dir d]              time, attempts and tokens ...",
   "kind": "observation",
   "text": "The CLI usage text and the README command table list the stats flags (--dir only)."
  },
  {
   "id": "FACT-010",
   "source_id": "task",
   "location": "task.md",
   "quote": "one object per run (id, status, mode, planner, reviewer, attempts, active seconds, ... usage state, and the damage reason for a damaged run) plus the totals",
   "kind": "assumption",
   "text": "JSON field names follow state.json snake_case; a damaged run object carries only id, status \"damaged\" and damaged (reason), since the table shows no data for it; planner/reviewer are the raw strings (empty when unknown) rather than the table's \"-\"."
  }
 ],
 "requirements": [
  {
   "id": "R-001",
   "statement": "`shogun stats --json` prints, instead of the table and totals text, one JSON document on stdout containing one object per run and a totals object.",
   "source_ids": [
    "task"
   ],
   "type": "functional",
   "mandatory": true,
   "criteria": [
    {
     "id": "R-001.C1",
     "text": "With --json, stdout parses as exactly one JSON document and contains neither the table header \"RUN\\tSTATUS\" nor the \"total:\" line."
    },
    {
     "id": "R-001.C2",
     "text": "Each readable run object has id, status, mode, planner, reviewer, attempts, active_seconds, input_tokens, cache_read_tokens, cache_write_tokens, output_tokens, reasoning_tokens, cost_usd and usage with the same values the table shows (active time in seconds, unrounded)."
    },
    {
     "id": "R-001.C3",
     "text": "A damaged run object has status \"damaged\" and its damage reason in a damaged field."
    },
    {
     "id": "R-001.C4",
     "text": "The totals object has the run count, runs by status, damaged count, attempts, active_seconds, the five token sums, cost_usd, the incomplete/unknown usage counts, and booleans telling whether spend (attempts, time) and usage (tokens, cost) totals are lower bounds, matching the text totals' 'at least' rules."
    }
   ]
  },
  {
   "id": "R-002",
   "statement": "Without --json the stats output stays exactly as it is now.",
   "source_ids": [
    "task"
   ],
   "type": "constraint",
   "mandatory": true,
   "criteria": [
    {
     "id": "R-002.C1",
     "text": "The existing TestStatsCountsEveryRunAndFlagsMissingUsage passes unmodified in its table assertions, and the table/totals format strings in stats.go are unchanged."
    }
   ]
  },
  {
   "id": "R-003",
   "statement": "The stats command stays read-only, with or without --json.",
   "source_ids": [
    "task"
   ],
   "type": "constraint",
   "mandatory": true,
   "criteria": [
    {
     "id": "R-003.C1",
     "text": "After `stats --json` a run's state.json is byte-identical to before."
    }
   ]
  }
 ],
 "source_coverage": [
  {
   "source_id": "task",
   "studied": "full text",
   "relevance": "relevant",
   "notes": "Defines the flag, fields and constraints."
  },
  {
   "source_id": "repo-1",
   "studied": "cmd/shogun/stats.go, stats_test.go, main.go (usage, dispatch, newFlagSet, parseArgs), other.go cmdStatus --json, internal/run/run.go Counters, README.md stats row",
   "relevance": "relevant",
   "notes": "All stats logic lives in cmd/shogun/stats.go; the status --json idiom is reused."
  }
 ],
 "web_sources": [],
 "approach": {
  "summary": "Add a `json` bool flag in cmdStats. Keep the existing loop that accumulates totals, but skip the tabwriter writes when --json is set, and collect one row struct per run instead. After the loop, in JSON mode, build a totals struct from the values already computed (tot, byStatus, damaged, partial, and the two 'at least' conditions), marshal {runs, totals} with json.MarshalIndent(…, \"\", \" \"), print it with Fprintln and return. The text path is left byte-for-byte as it is. Update the usage line and the README row, and extend the existing test with a --json run on the same fixture.",
  "alternatives": [
   {
    "name": "Marshal runStats/run.State directly",
    "why_not": "The fields are unexported and don't match the table's data (mode, usage, damage reason, and the totals are computed)."
   },
   {
    "name": "Separate accumulation from rendering in a new helper/refactor",
    "why_not": "A larger refactor than the flag needs. The in-loop guard is enough and leaves the text path untouched."
   },
   {
    "name": "Switch to parseArgs so the flag works in any position",
    "why_not": "stats takes no positional arguments, so fs.Parse is enough. Changing it is a side change."
   }
  ]
 },
 "steps": [
  {
   "id": "S-001",
   "title": "Add --json output to cmdStats",
   "objective": "`shogun stats --json` prints runs and totals as one JSON document; the text output stays the same.",
   "requirement_ids": [
    "R-001",
    "R-002",
    "R-003"
   ],
   "criterion_ids": [
    "R-001.C1",
    "R-001.C2",
    "R-001.C3",
    "R-001.C4",
    "R-002.C1"
   ],
   "depends_on": [],
   "targets": [
    {
     "repo_id": "repo-1",
     "path": "cmd/shogun/stats.go",
     "operation": "modify"
    },
    {
     "repo_id": "repo-1",
     "path": "cmd/shogun/main.go",
     "operation": "modify"
    },
    {
     "repo_id": "repo-1",
     "path": "README.md",
     "operation": "modify"
    }
   ],
   "actions": [
    "In stats.go import \"encoding/json\". After the --dir flag add `asJSON := fs.Bool(\"json\", false, \"print runs and totals as JSON on stdout\")`.",
    "Define two small types next to runStats. statsRow has json tags: id, status, damaged (omitempty string), and an embedded *statsCounts pointer. statsCounts holds mode, planner, reviewer, attempts, active_seconds, input_tokens, cache_read_tokens, cache_write_tokens, output_tokens, reasoning_tokens, cost_usd and usage, with no omitempty, so zeros stay visible. It is nil for a damaged run, so those fields are left out. statsTotals holds runs, by_status (map[string]int), damaged, attempts, active_seconds, the five token sums, cost_usd, usage_incomplete_runs, usage_unknown_runs, spend_lower_bound and usage_lower_bound.",
    "In the existing loop, guard each fmt.Fprintf(tw, …) (the header line too) with `if !*asJSON`. Append a statsRow per run: for a damaged run {id, \"damaged\", r.damaged, nil}; for a readable run {id, string(r.st.Status), \"\", &statsCounts{mode, r.planner, r.reviewer, counters…, u}}. Keep the accumulation of tot, byStatus, damaged and partial unchanged.",